{
  "version": "0.10.1",
  "channel": "stable",
  "published_at": "2026-07-21T21:13:28Z",
  "summary": "Repository snapshot 0.10.1.",
  "docker": {
    "image": "docker.io/parampo/nagient:0.10.1",
    "compose_url": "https://ngnt-in.ruka.me/0.10.1/docker-compose.yml"
  },
  "artifacts": [
    {
      "name": "install.sh",
      "url": "https://ngnt-in.ruka.me/0.10.1/install.sh",
      "kind": "installer",
      "platform": "linux-macos"
    },
    {
      "name": "update.sh",
      "url": "https://ngnt-in.ruka.me/0.10.1/update.sh",
      "kind": "installer",
      "platform": "linux-macos"
    },
    {
      "name": "uninstall.sh",
      "url": "https://ngnt-in.ruka.me/0.10.1/uninstall.sh",
      "kind": "installer",
      "platform": "linux-macos"
    },
    {
      "name": "install.ps1",
      "url": "https://ngnt-in.ruka.me/0.10.1/install.ps1",
      "kind": "installer",
      "platform": "windows"
    },
    {
      "name": "update.ps1",
      "url": "https://ngnt-in.ruka.me/0.10.1/update.ps1",
      "kind": "installer",
      "platform": "windows"
    },
    {
      "name": "uninstall.ps1",
      "url": "https://ngnt-in.ruka.me/0.10.1/uninstall.ps1",
      "kind": "installer",
      "platform": "windows"
    },
    {
      "name": "docker-compose.yml",
      "url": "https://ngnt-in.ruka.me/0.10.1/docker-compose.yml",
      "kind": "deployment",
      "platform": "any"
    }
  ],
  "migrations": [
    {
      "id": "state-sync-0.10.1",
      "from_version": "0.0.0",
      "to_version": "0.10.1",
      "description": "Sync runtime state and persisted metadata to the new release format.",
      "command": "nagient migrations sync-state"
    }
  ],
  "notices": [
    "Release metadata is generated by CI and powers install/update flows."
  ]
}
