{
  "version": "0.2.0",
  "channel": "stable",
  "published_at": "2026-04-24T01:00:00Z",
  "summary": "Fixture release for update checks.",
  "docker": {
    "image": "nagient:0.2.0",
    "compose_url": "0.2.0/docker-compose.yml"
  },
  "artifacts": [
    {
      "name": "install.sh",
      "url": "0.2.0/install.sh",
      "kind": "installer",
      "platform": "linux-macos"
    },
    {
      "name": "update.sh",
      "url": "0.2.0/update.sh",
      "kind": "installer",
      "platform": "linux-macos"
    },
    {
      "name": "uninstall.sh",
      "url": "0.2.0/uninstall.sh",
      "kind": "installer",
      "platform": "linux-macos"
    },
    {
      "name": "install.ps1",
      "url": "0.2.0/install.ps1",
      "kind": "installer",
      "platform": "windows"
    },
    {
      "name": "update.ps1",
      "url": "0.2.0/update.ps1",
      "kind": "installer",
      "platform": "windows"
    },
    {
      "name": "uninstall.ps1",
      "url": "0.2.0/uninstall.ps1",
      "kind": "installer",
      "platform": "windows"
    },
    {
      "name": "docker-compose.yml",
      "url": "0.2.0/docker-compose.yml",
      "kind": "deployment",
      "platform": "any"
    }
  ],
  "migrations": [
    {
      "id": "state-sync-0.1.0",
      "from_version": "0.0.0",
      "to_version": "0.1.0",
      "description": "Bootstrap state directory layout.",
      "command": "nagient migrations sync-state --to 0.1.0"
    },
    {
      "id": "state-sync-0.2.0",
      "from_version": "0.1.0",
      "to_version": "0.2.0",
      "description": "Normalize persisted release metadata.",
      "command": "nagient migrations sync-state --to 0.2.0"
    }
  ],
  "notices": [
    "Fixture manifest for automated tests."
  ]
}
